timestamp,endpoint,query,paperId,title,year,authors,venue,citations,url,abstract
2025-06-21T01-30-36-586Z.csv,searchPapers,cancer,3df293f1cc2167bcf53016a5f0853e2aaa9e1675,Targeting cancer cell metabolism: the combination of metformin and 2-deoxyglucose induces p53-dependent apoptosis in prostate cancer cells.,2010,I. Ben-Sahra; K. Laurent; S. Giuliano; F. Larbret; G. Ponzio; P. Gounon; Y. Le Marchand-Brustel; S. Giorgetti-Peraldi; M. Cormont; C. Bertolotto; M. Deckert; P. Auberger; J. Tanti; F. Bost,Cancer Research,514,https://www.semanticscholar.org/paper/3df293f1cc2167bcf53016a5f0853e2aaa9e1675,"Targeting cancer cell metabolism is a new promising strategy to fight cancer. Metformin, a widely used antidiabetic agent, exerts antitumoral and antiproliferative action. In this study, the addition of metformin to 2-deoxyglucose (2DG) inhibited mitochondrial respiration and glycolysis in prostate cancer cells leading to a severe depletion in ATP. The combination of the two drugs was much more harmful for cancer cells than the treatment with metformin or 2DG alone, leading to 96% inhibition of cell viability in LNCaP prostate cancer cells. In contrast, a moderate effect on cell viability was observed in normal prostate epithelial cells. At the cellular level, the combination of metformin and 2DG induced p53-dependent apoptosis via the energy sensor pathway AMP kinase, and the reexpression of a functional p53 in p53-deficient prostate cancer cells restored caspase-3 activity. In addition to apoptosis, the combination of metformin and 2DG arrested prostate cancer cells in G(2)-M. This G(2)-M arrest was independent of p53 and correlated with a stronger decrease in cell viability than obtained with either drug. Finally, metformin inhibited 2DG-induced autophagy, decreased beclin 1 expression, and triggered a switch from a survival process to cell death. Our study reinforces the growing interest of metabolic perturbators in cancer therapy and highlights the potential use of the combination of metformin and 2DG as an anticancerous treatment."
2025-06-21T01-30-36-586Z.csv,searchPapers,cancer,ea79c4f4e3f79664260b35edae29b9a74cd6a41e,ATM mutations that cause ataxia-telangiectasia are breast cancer susceptibility alleles,2006,A. Renwick; Deborah J. Thompson; S. Seal; P. Kelly; T. Chagtai; Munaza Ahmed; B. North; H. Jayatilake; R. Barfoot; Katarina Spanova; L. McGuffog; D. Evans; D. Eccles; D. Easton; M. Stratton; N. Rahman; The Breast Cancer Susceptibility Collaboration,Nature Genetics,763,https://www.semanticscholar.org/paper/ea79c4f4e3f79664260b35edae29b9a74cd6a41e,
2025-06-21T01-30-36-586Z.csv,searchPapers,cancer,5289a248cb3c1874bffcd96f432e489660ded97a,"The risk of extra‐colonic, extra‐endometrial cancer in the Lynch syndrome",2008,P. Watson; H. Vasen; J. Mecklin; I. Bernstein; M. Aarnio; H. Järvinen; T. Myrhøj; L. Sunde; J. Wijnen; H. Lynch,International Journal of Cancer,596,https://www.semanticscholar.org/paper/5289a248cb3c1874bffcd96f432e489660ded97a,
2025-06-21T01-30-36-586Z.csv,searchPapers,cancer,222da645f4b7f2cdddc53d00a134828fd0dd6d88,Comparing antibody and small-molecule therapies for cancer,2006,K. Imai; A. Takaoka,Nature Reviews. Cancer,772,https://www.semanticscholar.org/paper/222da645f4b7f2cdddc53d00a134828fd0dd6d88,
2025-06-21T01-30-36-586Z.csv,searchPapers,cancer,489e336af70dae7320b98f2bae550249be14d0c0,Ovarian cancer and oral contraceptives: collaborative reanalysis of data from 45 epidemiological studies including 23 257 women with ovarian cancer and 87 303 controls,2008,Collaborative Group on Hormonal Factors in Breast Cancer,The Lancet,710,https://www.semanticscholar.org/paper/489e336af70dae7320b98f2bae550249be14d0c0,
2025-06-21T01-30-36-586Z.csv,searchPapers,cancer,3f709c1838dbdf929be7992d1c2a80ce59af812d,Truncating mutations in the Fanconi anemia J gene BRIP1 are low-penetrance breast cancer susceptibility alleles,2006,S. Seal; Deborah J. Thompson; A. Renwick; Anna Elliott; P. Kelly; R. Barfoot; T. Chagtai; H. Jayatilake; Munaza Ahmed; Katarina Spanova; B. North; L. McGuffog; D. Evans; D. Eccles; D. Easton; M. Stratton; N. Rahman; The Breast Cancer Susceptibility Collaboration,Nature Genetics,746,https://www.semanticscholar.org/paper/3f709c1838dbdf929be7992d1c2a80ce59af812d,
2025-06-21T01-30-36-586Z.csv,searchPapers,cancer,06715ebb58e039de33558a43d6449621e879cea7,Loss of Keap1 function activates Nrf2 and provides advantages for lung cancer cell growth.,2008,T. Ohta; Kumiko Iijima; M. Miyamoto; Izumi Nakahara; Hiroshi Tanaka; Makiko Ohtsuji; Takafumi Suzuki; A. Kobayashi; J. Yokota; T. Sakiyama; T. Shibata; Masayuki Yamamoto; S. Hirohashi,Cancer Research,601,https://www.semanticscholar.org/paper/06715ebb58e039de33558a43d6449621e879cea7,"Oxidative and electrophilic stresses are sensed by Keap1, which activates Nrf2 to achieve cytoprotection by regulating the expression of drug-metabolizing and antioxidative stress enzymes/proteins. Because oxidative and electrophilic stresses cause many diseases, including cancer, we hypothesized that an abnormality in the Nrf2-Keap1 system may facilitate the growth of cancer cells. We sequenced the KEAP1 gene of 65 Japanese patients with lung cancer and identified five nonsynonymous somatic mutations at a frequency of 8%. We also identified two nonsynonymous somatic KEAP1 gene mutations and two lung cancer cell lines expressing KEAP1 at reduced levels. In lung cancer cells, low Keap1 activity (due to mutations or low-level expression) led to nuclear localization and constitutive activation of Nrf2. The latter resulted in constitutive expression of cytoprotective genes encoding multidrug resistance pumps, phase II detoxifying enzymes, and antioxidative stress enzymes/proteins. Up-regulation of these target genes in lung cancer cells led to cisplatin resistance. Nrf2 activation also stimulated growth of lung cancer-derived cell lines expressing KEAP1 at low levels and in mutant cell lines and in Keap1-null mouse embryonic fibroblasts under homeostatic conditions. Thus, inhibition of NRF2 may provide new therapeutic approaches in lung cancers with activation of Nrf2."
2025-06-21T01-30-36-586Z.csv,searchPapers,cancer,7c70eae503dd4b98fc90ed544c903efb5bbcdebe,The distinctive biology of cancer in adolescents and young adults,2008,A. Bleyer; R. Barr; B. Hayes-Lattin; David M. Thomas; C. Ellis; B. Anderson,Nature Reviews. Cancer,611,https://www.semanticscholar.org/paper/7c70eae503dd4b98fc90ed544c903efb5bbcdebe,
2025-06-21T01-30-36-586Z.csv,searchPapers,cancer,949f51cfde938cfa54f1195803f723efc3b16e1a,The Association of Telomere Length and Cancer: a Meta-analysis,2011,I. Wentzensen; L. Mirabello; R. Pfeiffer; S. Savage,"Cancer Epidemiology, Biomarkers and Prevention",462,https://www.semanticscholar.org/paper/949f51cfde938cfa54f1195803f723efc3b16e1a,
2025-06-21T01-30-36-586Z.csv,searchPapers,cancer,7c730c194901b6043c8d69df3c8368c7ed266153,Germline BRCA1 mutations and a basal epithelial phenotype in breast cancer.,2004,W. Foulkes; I. Stefansson; P. Chappuis; L. Bégin; J. Goffin; N. Wong; M. Trudel; L. Akslen,Journal of the National Cancer Institute,793,https://www.semanticscholar.org/paper/7c730c194901b6043c8d69df3c8368c7ed266153,"A basal epithelial phenotype is found in not more than 15% of all invasive breast cancers. Microarray studies have shown that this phenotype is associated with breast cancers that express neither estrogen receptor (ER) nor erbB-2 (HER2/neu) (i.e., ER/erbB-2-negative tumors). The ER/erbB-2- negative phenotype is also found in breast cancers occurring in BRCA1 mutation carriers (i.e., BRCA1-related breast cancers). We tested the hypothesis that BRCA1-related breast cancers are more likely than non-BRCA1/ 2-related breast cancer to express a basal epithelial phenotype. Among 292 breast cancer specimens previously analyzed for ER, erbB-2, p53, and germline mutations in BRCA1 and BRCA2, we identified 76 that did not overexpress ER or erbB-2. Of the 72 specimens with sufficient material for testing, 40 expressed stratified epithelial cytokeratin 5 and/or 6 (5/6). In univariate analysis, the expression of cytokeratin 5/6 was statistically significantly associated with BRCA1-related breast cancers (odds ratio = 9.0, 95% confidence interval = 1.9 to 43; P =.002, two-sided Fisher's exact test). Thus, germline BRCA1 mutations appear to be associated with a distinctive breast cancer phenotype."
2025-06-21T01-30-36-586Z.csv,searchPapers,cancer,7bfbc913e8287b5e1ef3e2830aa0e6dd7ad83383,Night-shift work and risk of colorectal cancer in the nurses' health study.,2003,E. Schernhammer; F. Laden; F. Speizer; W. Willett; D. Hunter; I. Kawachi; C. Fuchs; Graham A Colditz,Journal of the National Cancer Institute,808,https://www.semanticscholar.org/paper/7bfbc913e8287b5e1ef3e2830aa0e6dd7ad83383,"Exposure to light at night suppresses the physiologic production of melatonin, a hormone that has antiproliferative effects on intestinal cancers. Although observational studies have associated night-shift work with an increased risk of breast cancer, the effect of night-shift work on the risk of other cancers is not known. We prospectively examined the relationship between working rotating night shifts and the risk of colorectal cancers among female participants in the Nurses' Health Study. We documented 602 incident cases of colorectal cancer among 78 586 women who were followed up from 1988 through 1998. Compared with women who never worked rotating night shifts, women who worked 1-14 years or 15 years or more on rotating night shifts had multivariate relative risks of colorectal cancer of 1.00 (95% confidence interval [CI] = 0.84 to 1.19) and 1.35 (95% CI = 1.03 to 1.77), respectively (P(trend) =.04). These data suggest that working a rotating night shift at least three nights per month for 15 or more years may increase the risk of colorectal cancer in women."
2025-06-21T01-30-36-586Z.csv,searchPapers,cancer,8901b8280834f3fc901f22e18e3bec1b5dc5a95c,MGMT: its role in cancer aetiology and cancer therapeutics,2004,S. Gerson,Nature Reviews. Cancer,806,https://www.semanticscholar.org/paper/8901b8280834f3fc901f22e18e3bec1b5dc5a95c,
2025-06-21T01-30-36-586Z.csv,searchPapers,cancer,3a521eec051322b0312e0e657e9c74422bade341,"Human papillomavirus, smoking, and sexual practices in the etiology of anal cancer",2004,J. Daling; M. Madeleine; L. Johnson; S. Schwartz; Katherine A. Shera; M. Wurscher; Joseph J. Carter; P. Porter; D. Galloway; J. McDougall,Cancer,794,https://www.semanticscholar.org/paper/3a521eec051322b0312e0e657e9c74422bade341,
2025-06-21T01-30-36-586Z.csv,searchPapers,cancer,4dc92f460b156e0fb5d60812c7103b4f140f9c65,Attributable causes of lung cancer incidence and mortality in China,2011,Jian-bing Wang; Yaguang Fan; Yong Jiang; Ping Li; Hui-juan Xiao; Wanqing Chen; Wenqiang Wei; Qing-hua Zhou; Y. Qiao; P. Boffetta,Thoracic Cancer,420,https://www.semanticscholar.org/paper/4dc92f460b156e0fb5d60812c7103b4f140f9c65,
2025-06-21T01-30-36-586Z.csv,searchPapers,cancer,b4e1a2f8565cb72949cf6587ed7f7c327d4bfdf8,Chemoprevention of cancer.,1994,C. Szarka; G. Grana; P. Engstrom,Current Problems in Cancer,929,https://www.semanticscholar.org/paper/b4e1a2f8565cb72949cf6587ed7f7c327d4bfdf8,
2025-06-21T01-30-36-586Z.csv,searchPapers,cancer,093f956878a76cb931ee45caa36a52f5169a0abf,An estimate of premature cancer mortality in the U.S. due to inadequate doses of solar ultraviolet‐B radiation,2002,W. Grant,Cancer,772,https://www.semanticscholar.org/paper/093f956878a76cb931ee45caa36a52f5169a0abf,
2025-06-21T01-30-36-586Z.csv,searchPapers,cancer,6800ef0e9c163952e3ddc186bfb944e9396fe5d5,Aspirin use and risk of fatal cancer.,1993,M. Thun; M. Namboodiri; E. Calle; W. Flanders; C. Heath,Cancer Research,922,https://www.semanticscholar.org/paper/6800ef0e9c163952e3ddc186bfb944e9396fe5d5,
2025-06-21T01-30-36-586Z.csv,searchPapers,cancer,b3c448bfe78b07d99a0c1d0c63cb6db0ed9cd041,Fear of Cancer Recurrence Inventory: development and initial validation of a multidimensional measure of fear of cancer recurrence,2009,S. Simard; J. Savard,Supportive Care in Cancer,524,https://www.semanticscholar.org/paper/b3c448bfe78b07d99a0c1d0c63cb6db0ed9cd041,
2025-06-21T01-30-36-586Z.csv,searchPapers,cancer,2ecea2f124c1635d3ae4f6b52c9506f97773f0e8,"Population BRCA1 and BRCA2 mutation frequencies and cancer penetrances: a kin-cohort study in Ontario, Canada.",2006,H. Risch; J. McLaughlin; D. Cole; B. Rosen; L. Bradley; I. Fan; James Tang; Song Li; Shiyu Zhang; P. Shaw; S. Narod,Journal of the National Cancer Institute,680,https://www.semanticscholar.org/paper/2ecea2f124c1635d3ae4f6b52c9506f97773f0e8,"BACKGROUND
BRCA1 and BRCA2 mutations in general populations and in various types of cancers have not been well characterized. We investigated the presence of these mutations in unselected patients with newly diagnosed incident ovarian cancer in Ontario, Canada, with respect to cancers reported among their relatives.


METHODS
A population series of 1171 unselected patients with incident ovarian cancer diagnosed between January 1, 1995, and December 31, 1999, in Ontario, Canada, was screened for germline mutations throughout the BRCA1 and BRCA2 genes. Screening involved testing for common variants, then protein truncation testing of long exons, and then denaturing gradient gel electrophoresis or denaturing high-performance liquid chromatography for the remainder of BRCA1 and BRCA2, respectively. Cox regression analysis was used to examine cancer outcomes reported by the case probands for their 8680 first-degree relatives. Population allele frequencies and relative risks (RRs) were derived from the regression results by an extension of Saunders-Begg methods. Age-specific Ontario cancer incidence rates were used to estimate cumulative incidence of cancer to age 80 years by mutation status.


RESULTS
Among 977 patients with invasive ovarian cancer, 75 had BRCA1 mutations and 54 had BRCA2 mutations, for a total mutation frequency of 13.2% (95% confidence interval [CI] = 11.2% to 15.5%). Higher risks for various cancer types in the general Ontario population were associated with BRCA1 mutation carriage than with noncarriage, including ovarian (RR = 21, 95% CI = 12 to 36), female breast (RR = 11, 95% CI = 7.5 to 15), and testis (RR = 17, 95% CI = 1.3 to 230) cancers. Higher risks were also associated with BRCA2 mutation carriage than with noncarriage, particularly for ovarian (RR = 7.0, 95% CI = 3.1 to 16), female and male breast (RR = 4.6, 95% CI = 2.7 to 7.8, and RR = 102, 95% CI = 9.9 to 1050, respectively), and pancreatic (RR = 6.6, 95% CI = 1.9 to 23) cancers. Cancer risks differed according to the mutation's position in the gene. Estimated cumulative incidence to age 80 years among women carrying BRCA1 mutations was 24% for ovarian cancer and 90% for breast cancer and among women carrying BRCA2 mutations was 8.4% for ovarian cancer and 41% for breast cancer. For the general Ontario population, estimated carrier frequencies of BRCA1 and BRCA2 mutations, respectively, were 0.32% (95% CI = 0.23% to 0.45%) and 0.69% (95% CI = 0.43% to 1.10%).


CONCLUSIONS
BRCA1 and BRCA2 mutations may be more frequent in general populations than previously thought and may be associated with various types of cancers."
2025-06-21T01-30-36-586Z.csv,searchPapers,cancer,7e1665fb046620e3c83c2bf0d54b219a4bbdbcd4,Maximizing mouse cancer models,2007,K. Frese; D. Tuveson,Nature Reviews. Cancer,697,https://www.semanticscholar.org/paper/7e1665fb046620e3c83c2bf0d54b219a4bbdbcd4,
2025-06-21T01-30-36-586Z.csv,searchPapers,cancer,22e0bfb13bb639c6a10bfc9dd29eb167ec8e277d,"Obesity and Risk of Colorectal Cancer: A Meta-analysis of 31 Studies with 70,000 Events",2007,Ali G. Moghaddam; M. Woodward; R. Huxley,"Cancer Epidemiology, Biomarkers and Prevention",646,https://www.semanticscholar.org/paper/22e0bfb13bb639c6a10bfc9dd29eb167ec8e277d,
2025-06-21T01-30-36-586Z.csv,searchPapers,cancer,ab555179b2d69f4610b170abbc5bfa4b82475a57,Normal stem cells and cancer stem cells: the niche matters.,2006,Linheng Li; W. Neaves,Cancer Research,703,https://www.semanticscholar.org/paper/ab555179b2d69f4610b170abbc5bfa4b82475a57,"Scientists have tried for decades to understand cancer development in the context of therapeutic strategies. The realization that cancers may rely on ""cancer stem cells"" that share the self-renewal feature of normal stem cells has changed the perspective with regard to new approaches for treating the disease. In this review, we propose that one of the differences between normal stem cells and cancer stem cells is their degree of dependence on the stem cell niche, a specialized microenvironment in which stem cells reside. The stem cell niche in adult somatic tissues plays an essential role in maintaining stem cells or preventing tumorigenesis by providing primarily inhibitory signals for both proliferation and differentiation. However, the niche also provides transient signals for stem cell division to support ongoing tissue regeneration. The balance between proliferation-inhibiting and proliferation-promoting signals is the key to homeostatic regulation of stem cell maintenance versus tissue regeneration. Loss of the niche can lead to loss of stem cells, indicating the reliance of stem cells on niche signals. Therefore, cancer stem cells may arise from an intrinsic mutation, leading to self-sufficient cell proliferation, and/or may also involve deregulation or alteration of the niche by dominant proliferation-promoting signals. Furthermore, the molecular machinery used by normal stem cells for homing to or mobilizing from the niche may be ""hijacked"" by cancer stem cells for invasion and metastasis. We hope this examination of the interaction between stem cells and their niche will enhance understanding of the process of cancer development, invasiveness, and metastasis and reveal possible targets for cancer treatment."
2025-06-21T01-30-36-586Z.csv,searchPapers,cancer,f8f8b2057cdac3a337c15b8f317307403acaa419,CXCR4 Regulates Growth of Both Primary and Metastatic Breast Cancer,2004,Matthew C. P. Smith; K. Luker; J. Garbow; Julie L. Prior; Erin N. Jackson; D. Piwnica-Worms; G. Luker,Cancer Research,725,https://www.semanticscholar.org/paper/f8f8b2057cdac3a337c15b8f317307403acaa419,
2025-06-21T01-30-36-586Z.csv,searchPapers,cancer,cf6a51505678de70771be262ac92290b5bb81a3b,"PF00299804, an irreversible pan-ERBB inhibitor, is effective in lung cancer models with EGFR and ERBB2 mutations that are resistant to gefitinib.",2007,J. Engelman; K. Zejnullahu; Christopher-Michael Gale; E. Lifshits; A. Gonzales; T. Shimamura; F. Zhao; P. Vincent; G. Naumov; J. Bradner; I. Althaus; L. Gandhi; G. Shapiro; J. Nelson; J. Heymach; M. Meyerson; Kwok-kin Wong; P. Jänne,Cancer Research,696,https://www.semanticscholar.org/paper/cf6a51505678de70771be262ac92290b5bb81a3b,"Epidermal growth factor receptor (EGFR) tyrosine kinase inhibitors gefitinib and erlotinib are effective treatments for a subset of non-small cell lung cancers. In particular, cancers with specific EGFR-activating mutations seem to be the most sensitive to these agents. However, despite their initial response, such cancers almost invariably develop resistance. In 50% of such cancers, a secondary EGFR mutation, T790M, has been identified that renders gefitinib and erlotinib ineffective inhibitors of EGFR kinase activity. Thus, there is a clinical need to develop novel EGFR inhibitors that can effectively inactivate T790M-containing EGFR proteins. In this study, we evaluate the effectiveness of a novel compound, PF00299804, an irreversible pan-ERBB inhibitor. The results from these studies show that PF00299804 is a potent inhibitor of EGFR-activating mutations as well as the EGFR T790M resistance mutation both in vitro and in vivo. Additionally, PF00299804 is a highly effective inhibitor of both the wild-type ERBB2 and the gefitinib-resistant oncogenic ERBB2 mutation identified in lung cancers. These preclinical evaluations support further clinical development of PF00299804 for cancers with mutations and/or amplifications of ERBB family members."
2025-06-21T01-30-36-586Z.csv,searchPapers,cancer,271899fff7ff7d98228235762c17c3db3c4ca707,Evolution of cancer of the colon and rectum,1974,B. Morson,Cancer,1138,https://www.semanticscholar.org/paper/271899fff7ff7d98228235762c17c3db3c4ca707,
2025-06-21T01-30-36-586Z.csv,searchPapers,cancer,c0cd225c862766beb7861fca8c176d5a8dade5b2,"The cancer/testis genes: review, standardization, and commentary.",2004,M. Scanlan; A. Simpson; L. Old,Cancer Immunity,715,https://www.semanticscholar.org/paper/c0cd225c862766beb7861fca8c176d5a8dade5b2,
2025-06-21T01-30-36-586Z.csv,searchPapers,cancer,8535df247b376781f27bbde96f1212da1884bab5,Measuring psychological and physical distress in cancer patients: structure and application of the Rotterdam Symptom Checklist.,1990,J. D. Haes; Fce van Knippenberg; J. Neijt,British Journal of Cancer,933,https://www.semanticscholar.org/paper/8535df247b376781f27bbde96f1212da1884bab5,"Use of the Rotterdam Symptom Checklist (RSCL) to measure psychological and physical distress as experienced by cancer patients, is discussed in this paper. The stability of the structure of the RSCL was assessed in principal component analyses in three studies: one concerning cancer patients during either chemotherapy or follow-up (n = 86), one done in patients undergoing chemotherapy for advanced ovarian cancer (n = 56), and the third dealing with cancer patients under treatment, disease-free 'patients', and 'normal' controls (n = 611). The psychological dimension proved to be stable across populations. A scale based on this factor was highly reliable (Cronbach's alpha 0.88-0.94). The physical distress is reflected by several dimensions in a homogeneous population (pain, fatigue, gastrointestinal complaints) and undimensionally in a heterogeneous population. Reliability of the physical distress scales is good (0.71-0.88). The current components of the RSCL and the use of individual and disease specific symptoms are discussed."
2025-06-21T01-30-36-586Z.csv,searchPapers,cancer,cdce75a7b8d955614031277e1ba40e51606af124,"Hormonal etiology of epithelial ovarian cancer, with a hypothesis concerning the role of androgens and progesterone.",1999,H. Risch,Journal of the National Cancer Institute,808,https://www.semanticscholar.org/paper/cdce75a7b8d955614031277e1ba40e51606af124,"In the United States, ovarian cancer is the fourth most frequent cause of cancer death among women, following lung, breast, and colorectal cancers. Each year, approximately 26,000 women are diagnosed with ovarian cancer and 14,000 die of it. Germline mutations in BRCA1, BRCA2, or other genes have been implicated in a small fraction of cases. However, it has been suggested that, for the great majority of patients, the risk of epithelial ovarian cancer could be related to ""incessant ovulation"" (i.e., to the chronically repeated formation of stromal epithelial clefts and inclusion cysts following ovulation) or to some type of hormonal stimulation of ovarian epithelial cells, either on the surface of the ovary or within ovarian inclusion cysts, possibly mediated through excessive gonadotropin secretion. From the evidence to date, the relative importance of these two hypotheses--incessant ovulation and gonadotropin stimulation--cannot be distinguished. While either or both may play a role in the development of ovarian cancer, it appears that an additional major factor must also be involved. The purpose of this review is to evaluate evidence for and against the incessant ovulation and gonadotropin hypotheses, as well as to consider the possibility that risk of ovarian cancer may be increased by factors associated with excess androgenic stimulation of ovarian epithelial cells and may be decreased by factors related to greater progesterone stimulation. Many features of the evidence bearing on the pathophysiology of ovarian cancer appear to support a connection with androgens and progesterone."
2025-06-21T01-30-36-586Z.csv,searchPapers,cancer,c710d63efd274670f133f3c18a99f664f9d484d1,Increased cell division as a cause of human cancer.,1990,S. Preston‐Martin; M. Pike; R. Ross; P. A. Jones; B. Henderson,Cancer Research,936,https://www.semanticscholar.org/paper/c710d63efd274670f133f3c18a99f664f9d484d1,
2025-06-21T01-30-36-586Z.csv,searchPapers,cancer,859d8e794aea4a63c618529798f3b18772d284ce,Fatigue in cancer patients compared with fatigue in the general United States population,2002,D. Cella; J. Lai; Chih-Hung Chang; A. Peterman; M. Slavin,Cancer,757,https://www.semanticscholar.org/paper/859d8e794aea4a63c618529798f3b18772d284ce,
2025-06-21T01-30-36-586Z.csv,searchPapers,cancer,06cb78be8f84d1c39e30f6a2390a71ed1a8b6035,Cigarette smoking and colorectal cancer incidence and mortality: Systematic review and meta‐analysis,2009,Peter S. Liang; Ting‐Yi Chen; E. Giovannucci,International Journal of Cancer,530,https://www.semanticscholar.org/paper/06cb78be8f84d1c39e30f6a2390a71ed1a8b6035,
