timestamp,endpoint,query,paperId,title,year,authors,venue,citations,url,abstract
2025-06-21T01-30-36-586Z.csv,searchPapers,cancer,ba4049672ccacb5319d9922aea38b7efd5572881,Tamoxifen for the prevention of breast cancer: current status of the National Surgical Adjuvant Breast and Bowel Project P-1 study.,2005,B. Fisher; J. Costantino; D. Wickerham; R. Cecchini; W. Cronin; A. Robidoux; T. Bevers; M. Kavanah; J. Atkins; R. Margolese; C. Runowicz; J. James; L. Ford; N. Wolmark; N. Wolmark,Journal of the National Cancer Institute,1317,https://www.semanticscholar.org/paper/ba4049672ccacb5319d9922aea38b7efd5572881,"BACKGROUND
Initial findings from the National Surgical Adjuvant Breast and Bowel Project Breast Cancer Prevention Trial (P-1) demonstrated that tamoxifen reduced the risk of estrogen receptor-positive tumors and osteoporotic fractures in women at increased risk for breast cancer. Side effects of varying clinical significance were observed. The trial was unblinded because of the positive results, and follow-up continued. This report updates our initial findings.


METHODS
Women (n = 13,388) were randomly assigned to receive placebo or tamoxifen for 5 years. Rates of breast cancer and other events were compared by the use of risk ratios (RRs) and 95% confidence intervals (CIs). Estimates of the net benefit from 5 years of tamoxifen therapy were compared by age, race, and categories of predicted breast cancer risk. Statistical tests were two-sided.


RESULTS
After 7 years of follow-up, the cumulative rate of invasive breast cancer was reduced from 42.5 per 1000 women in the placebo group to 24.8 per 1000 women in the tamoxifen group (RR = 0.57, 95% CI = 0.46 to 0.70) and the cumulative rate of noninvasive breast cancer was reduced from 15.8 per 1000 women in the placebo group to 10.2 per 1000 women in the tamoxifen group (RR = 0.63, 95% CI = 0.45 to 0.89). These reductions were similar to those seen in the initial report. Tamoxifen led to a 32% reduction in osteoporotic fractures (RR = 0.68, 95% CI = 0.51 to 0.92). Relative risks of stroke, deep-vein thrombosis, and cataracts (which increased with tamoxifen) and of ischemic heart disease and death (which were not changed with tamoxifen) were also similar to those initially reported. Risks of pulmonary embolism were approximately 11% lower than in the original report, and risks of endometrial cancer were about 29% higher, but these differences were not statistically significant. The net benefit achieved with tamoxifen varied according to age, race, and level of breast cancer risk.


CONCLUSIONS
Despite the potential bias caused by the unblinding of the P-1 trial, the magnitudes of all beneficial and undesirable treatment effects of tamoxifen were similar to those initially reported, with notable reductions in breast cancer and increased risks of thromboembolic events and endometrial cancer. Readily identifiable subsets of individuals comprising 2.5 million women could derive a net benefit from the drug."
2025-06-21T01-30-36-586Z.csv,searchPapers,cancer,e5d4cb75d57d02cac8105d3e19f8e7403aba5a22,The physics of cancer: the role of physical interactions and mechanical forces in metastasis,2011,D. Wirtz; K. Konstantopoulos; P. Searson,Nature Reviews. Cancer,1173,https://www.semanticscholar.org/paper/e5d4cb75d57d02cac8105d3e19f8e7403aba5a22,
2025-06-21T01-30-36-586Z.csv,searchPapers,cancer,ce2da4b941a41be41a16853f8b60c07b752f5c16,The Prioritization of Cancer Antigens: A National Cancer Institute Pilot Project for the Acceleration of Translational Research,2009,M. Cheever; J. Allison; A. Ferris; O. Finn; Benjamin M Hastings; T. Hecht; I. Mellman; S. Prindiville; J. Viner; L. Weiner; L. Matrisian,Clinical Cancer Research,1285,https://www.semanticscholar.org/paper/ce2da4b941a41be41a16853f8b60c07b752f5c16,
2025-06-21T01-30-36-586Z.csv,searchPapers,cancer,ce5a510a69066e7b8ebad1e864e1a111edf5dc19,"Organ Preservation in Rectal Adenocarcinoma: a phase II randomized controlled trial evaluating 3-year disease-free survival in patients with locally advanced rectal cancer treated with chemoradiation plus induction or consolidation chemotherapy, and total mesorectal excision or nonoperative manageme",2015,J. Smith; O. Chow; M. Gollub; G. Nash; L. Temple; M. Weiser; J. Guillem; P. Paty; Karin Avila; J. García-Aguilar; on behalf of the Rectal Cancer Consortium,BMC Cancer,328,https://www.semanticscholar.org/paper/ce5a510a69066e7b8ebad1e864e1a111edf5dc19,"BackgroundTreatment of patients with non-metastatic, locally advanced rectal cancer (LARC) includes pre-operative chemoradiation, total mesorectal excision (TME) and post-operative adjuvant chemotherapy. This trimodality treatment provides local tumor control in most patients; but almost one-third ultimately die from distant metastasis. Most survivors experience significant impairment in quality of life (QoL), due primarily to removal of the rectum. A current challenge lies in identifying patients who could safely undergo rectal preservation without sacrificing survival benefit and QoL.Methods/DesignThis multi-institutional, phase II study investigates the efficacy of total neoadjuvant therapy (TNT) and selective non-operative management (NOM) in LARC. Patients with MRI-staged Stage II or III rectal cancer amenable to TME will be randomized to receive FOLFOX/CAPEOX: a) before induction neoadjuvant chemotherapy (INCT); or b) after consolidation neoadjuvant chemotherapy (CNCT), with 5-FU or capecitabine-based chemoradiation. Patients in both arms will be re-staged after completing all neoadjuvant therapy. Those with residual tumor at the primary site will undergo TME. Patients with clinical complete response (cCR) will receive non-operative management (NOM). NOM patients will be followed every 3 months for 2 years, and every 6 months thereafter. TME patients will be followed according to NCCN guidelines. All will be followed for at least 5 years from the date of surgery or—in patients treated with NOM—the last day of treatment.DiscussionThe studies published thus far on the safety of NOM in LARC have compared survival between select groups of patients with a cCR after NOM, to patients with a pathologic complete response (pCR) after TME. The current study compares 3-year disease-free survival (DFS) in an entire population of patients with LARC, including those with cCR and those with pCR. We will compare the two arms of the study with respect to organ preservation at 3 years, treatment compliance, adverse events and surgical complications. We will measure QoL in both groups. We will analyze molecular indications that may lead to more individually tailored treatments in the future. This will be the first NOM trial utilizing a regression schema for response assessment in a prospective fashion.Trial registrationNCT02008656"
2025-06-21T01-30-36-586Z.csv,searchPapers,cancer,76fe00651947c874f98f74eac2423c878e072238,Prognostic markers in triple‐negative breast cancer,2007,E. Rakha; M. E. El-Sayed; A. Green; Andrew H. S. Lee; J. Robertson; I. Ellis,Cancer,1284,https://www.semanticscholar.org/paper/76fe00651947c874f98f74eac2423c878e072238,
2025-06-21T01-30-36-586Z.csv,searchPapers,cancer,e34f3c2bd6c3fd20152e3a413fa1528b450080ed,Blood-based analyses of cancer: circulating tumor cells and circulating tumor DNA.,2014,D. Haber; V. Velculescu,Cancer Discovery,605,https://www.semanticscholar.org/paper/e34f3c2bd6c3fd20152e3a413fa1528b450080ed,"UNLABELLED
The ability to study nonhematologic cancers through noninvasive sampling of blood is one of the most exciting and rapidly advancing fields in cancer diagnostics. This has been driven both by major technologic advances, including the isolation of intact cancer cells and the analysis of cancer cell-derived DNA from blood samples, and by the increasing application of molecularly driven therapeutics, which rely on such accurate and timely measurements of critical biomarkers. Moreover, the dramatic efficacy of these potent cancer therapies drives the selection for additional genetic changes as tumors acquire drug resistance, necessitating repeated sampling of cancer cells to adjust therapy in response to tumor evolution. Together, these advanced noninvasive diagnostic capabilities and their applications in guiding precision cancer therapies are poised to change the ways in which we select and monitor cancer treatments.


SIGNIFICANCE
Recent advances in technologies to analyze circulating tumor cells and circulating tumor DNA are setting the stage for real-time, noninvasive monitoring of cancer and providing novel insights into cancer evolution, invasion, and metastasis."
2025-06-21T01-30-36-586Z.csv,searchPapers,cancer,1c0488e332636ddacd73327935a4772d27b8800c,Human papillomavirus and oral cancer: the International Agency for Research on Cancer multicenter study.,2003,R. Herrero; X. Castellsagué; M. Pawlita; J. Lissowska; F. Kee; P. Balaram; T. Rajkumar; H. Sridhar; B. Rose; J. Pintos; L. Fernandez; A. Idris; María-José Sánchez; A. Nieto; R. Talamini; A. Tavani; F. Bosch; U. Reidel; P. Snijders; C. Meijer; R. Viscidi; N. Muñoz; S. Franceschi,Journal of the National Cancer Institute,1263,https://www.semanticscholar.org/paper/1c0488e332636ddacd73327935a4772d27b8800c,"BACKGROUND
Human papillomavirus (HPV), the causal agent of cervical cancer, appears to be involved in the etiology of cancer of the oral cavity and oropharynx. To investigate these associations, we conducted a multicenter case-control study of cancer of the oral cavity and oropharynx in nine countries.


METHODS
We recruited 1670 case patients (1415 with cancer of the oral cavity and 255 with cancer of the oropharynx) and 1732 control subjects and obtained an interview, oral exfoliated cells, and blood from all participants and fresh biopsy specimens from case patients. HPV DNA was detected by polymerase chain reaction (PCR). Antibodies against HPV16 L1, E6, and E7 proteins in plasma were detected with enzyme-linked immunosorbent assays. Multivariable models were used for case-control and case-case comparisons.


RESULTS
HPV DNA was detected in biopsy specimens of 3.9% (95% confidence interval [CI] = 2.5% to 5.3%) of 766 cancers of the oral cavity with valid PCR results and 18.3% (95% CI = 12.0% to 24.7%) of 142 cancers of the oropharynx (oropharynx and tonsil combined) with valid PCR results. HPV DNA in cancer biopsy specimens was detected less frequently among tobacco smokers and paan chewers and more frequently among subjects who reported more than one sexual partner or who practiced oral sex. HPV16 DNA was found in 94.7% of HPV DNA-positive case patients. HPV DNA in exfoliated cells was not associated with cancer risk or with HPV DNA detection in biopsy specimens. Antibodies against HPV16 L1 were associated with risk for cancers of the oral cavity (odds ratio [OR] = 1.5, 95% CI = 1.1 to 2.1) and the oropharynx (OR = 3.5, 95% CI = 2.1 to 5.9). Antibodies against HPV16 E6 or E7 were also associated with risk for cancers of the oral cavity (OR = 2.9, 95% CI = 1.7 to 4.8) and the oropharynx (OR = 9.2, 95% CI = 4.8 to 17.7).


CONCLUSIONS
HPV appears to play an etiologic role in many cancers of the oropharynx and possibly a small subgroup of cancers of the oral cavity. The most common HPV type in genital cancers (HPV16) was also the most common in these tumors. The mechanism of transmission of HPV to the oral cavity warrants further investigation."
2025-06-21T01-30-36-586Z.csv,searchPapers,cancer,13d051ab8ed2c0d3d10595d47e2665ccd2074ca8,Catalog of Chromosome Aberrations in Cancer,1996,L. Secker-Walker,British Journal of Cancer,1524,https://www.semanticscholar.org/paper/13d051ab8ed2c0d3d10595d47e2665ccd2074ca8,"We present here because it will be so easy for you to access the internet service. As in this new era, much technology is sophistically offered by connecting to the internet. No any problems to face, just for this day, you can really keep in mind that the book is the best book for you. We offer the best here to read. After deciding how your feeling will be, you can enjoy to visit the link and get the book."
2025-06-21T01-30-36-586Z.csv,searchPapers,cancer,c0eb28d12221396ec223fbcc61168e54adf26e4c,MicroRNA signatures in human ovarian cancer.,2007,M. Iorio; R. Visone; Gianpiero di Leva; V. Donati; F. Petrocca; P. Casalini; C. Taccioli; S. Volinia; Chang-gong Liu; H. Alder; G. Calin; S. Ménard; C. Croce,Cancer Research,1234,https://www.semanticscholar.org/paper/c0eb28d12221396ec223fbcc61168e54adf26e4c,"Epithelial ovarian cancer (EOC) is the sixth most common cancer in women worldwide and, despite advances in detection and therapies, it still represents the most lethal gynecologic malignancy in the industrialized countries. Unfortunately, still relatively little is known about the molecular events that lead to the development of this highly aggressive disease. The relatively recent discovery of microRNAs (miRNA), a class of small noncoding RNAs targeting multiple mRNAs and triggering translation repression and/or RNA degradation, has revealed the existence of a new level of gene expression regulation. Multiple studies involving various types of human cancers proved that miRNAs have a causal role in tumorigenesis. Here we show that, in comparison to normal ovary, miRNAs are aberrantly expressed in human ovarian cancer. The overall miRNA expression could clearly separate normal versus cancer tissues. The most significantly overexpressed miRNAs were miR-200a, miR-141, miR-200c, and miR-200b, whereas miR-199a, miR-140, miR-145, and miR-125b1 were among the most down-modulated miRNAs. We could also identify miRNAs whose expression was correlated with specific ovarian cancer biopathologic features, such as histotype, lymphovascular and organ invasion, and involvement of ovarian surface. Moreover, the levels of miR-21, miR-203, and miR-205, up-modulated in ovarian carcinomas compared with normal tissues, were significantly increased after 5-aza-2'-deoxycytidine demethylating treatment of OVCAR3 cells, suggesting that the DNA hypomethylation could be the mechanism responsible for their overexpression. Our results indicate that miRNAs might play a role in the pathogenesis of human EOC and identify altered miRNA gene methylation as a possible epigenetic mechanism involved in their aberrant expression."
2025-06-21T01-30-36-586Z.csv,searchPapers,cancer,8e19bc2cee9226cffa317f152c29d27c35df841d,Cancer to bone: a fatal attraction,2011,K. Weilbaecher; T. Guise; L. McCauley,Nature Reviews. Cancer,1161,https://www.semanticscholar.org/paper/8e19bc2cee9226cffa317f152c29d27c35df841d,
2025-06-21T01-30-36-586Z.csv,searchPapers,cancer,25cc01578d74334d2b642dc1e194194066d50b38,Biologically active sphingolipids in cancer pathogenesis and treatment,2004,B. Ogretmen; Y. Hannun,Nature Reviews. Cancer,1248,https://www.semanticscholar.org/paper/25cc01578d74334d2b642dc1e194194066d50b38,
2025-06-21T01-30-36-586Z.csv,searchPapers,cancer,b7e3bec7efda0946a73d8cfa06550ef2b1a2b2bd,The COSMIC (Catalogue of Somatic Mutations in Cancer) database and website,2004,S. Bamford; E. Dawson; S. Forbes; J. Clements; Roger Pettett; A. Doğan; A. Flanagan; J. Teague; P. Futreal; Michael R. Stratton; R. Wooster,British Journal of Cancer,1196,https://www.semanticscholar.org/paper/b7e3bec7efda0946a73d8cfa06550ef2b1a2b2bd,"The discovery of mutations in cancer genes has advanced our understanding of cancer. These results are dispersed across the scientific literature and with the availability of the human genome sequence will continue to accrue. The COSMIC (Catalogue of Somatic Mutations in Cancer) database and website have been developed to store somatic mutation data in a single location and display the data and other information related to human cancer. To populate this resource, data has currently been extracted from reports in the scientific literature for somatic mutations in four genes, BRAF, HRAS, KRAS2 and NRAS. At present, the database holds information on 66 634 samples and reports a total of 10 647 mutations. Through the web pages, these data can be queried, displayed as figures or tables and exported in a number of formats. COSMIC is an ongoing project that will continue to curate somatic mutation data and release it through the website."
2025-06-21T01-30-36-586Z.csv,searchPapers,cancer,9d96d169283a80e4c74f6297b50d9a769ad9935a,Validating survivin as a cancer therapeutic target,2003,D. Altieri,Nature Reviews. Cancer,1246,https://www.semanticscholar.org/paper/9d96d169283a80e4c74f6297b50d9a769ad9935a,
2025-06-21T01-30-36-586Z.csv,searchPapers,cancer,cbc213723edf473cc9e5a5986713e5013b0c217a,Achieving world-class cancer outcomes: a strategy for England 2015-2020,2015,Independent Cancer Taskforce,,246,https://www.semanticscholar.org/paper/cbc213723edf473cc9e5a5986713e5013b0c217a,
2025-06-21T01-30-36-586Z.csv,searchPapers,cancer,d47f3a571db095270e486c56d59b791099c05059,The biology of cancer-related fatigue: a review of the literature,2015,L. Saligan; K. Olson; Kristin Filler; David Larkin; F. Cramp; Y. Sriram; C. Escalante; A. Giglio; K. Kober; Jayesh Kamath; O. Palesh; K. Mustian; Multinational Association of Supportive Care in Cancer Fatigue S Group,Supportive Care in Cancer,246,https://www.semanticscholar.org/paper/d47f3a571db095270e486c56d59b791099c05059,
2025-06-21T01-30-36-586Z.csv,searchPapers,cancer,2af986c5f55bfedf2e78f92ee5b773b93cea4a44,Significance of CD90+ cancer stem cells in human liver cancer.,2008,Z. Yang; D. Ho; M. Ng; C. Lau; W. Yu; P. Ngai; P. Chu; C. Lam; R. Poon; S. Fan,Cancer Cell,1202,https://www.semanticscholar.org/paper/2af986c5f55bfedf2e78f92ee5b773b93cea4a44,
2025-06-21T01-30-36-586Z.csv,searchPapers,cancer,c81808cdc66d426920916ad166a2ce5e7baa80ae,γH2AX and cancer,2008,W. Bonner; C. Redon; J. Dickey; A. Nakamura; O. Sedelnikova; S. Solier; Y. Pommier,Nature Reviews. Cancer,1251,https://www.semanticscholar.org/paper/c81808cdc66d426920916ad166a2ce5e7baa80ae,
2025-06-21T01-30-36-586Z.csv,searchPapers,cancer,b3056e01d0a7f8f37d1fbd49553c6106160c8bf4,"Increased circulating myeloid-derived suppressor cells correlate with clinical cancer stage, metastatic tumor burden, and doxorubicin–cyclophosphamide chemotherapy",2008,C. Diaz-Montero; M. L. Salem; M. Nishimura; E. Garrett-Mayer; D. Cole; A. Montero,Cancer Immunology and Immunotherapy,1257,https://www.semanticscholar.org/paper/b3056e01d0a7f8f37d1fbd49553c6106160c8bf4,
2025-06-21T01-30-36-586Z.csv,searchPapers,cancer,d4435292f076384d1a76f39fd100c8b369cf3756,"Prostate cancer screening in the randomized Prostate, Lung, Colorectal, and Ovarian Cancer Screening Trial: mortality results after 13 years of follow-up.",2012,G. Andriole; E. Crawford; R. Grubb; S. Buys; D. Chia; T. Church; M. Fouad; C. Isaacs; P. Kvale; D. Reding; J. Weissfeld; L. Yokochi; B. O'Brien; L. Ragard; J. Clapp; J. Rathmell; T. Riley; A. Hsing; G. Izmirlian; P. Pinsky; B. Kramer; A. Miller; J. Gohagan; P. Prorok,Journal of the National Cancer Institute,1094,https://www.semanticscholar.org/paper/d4435292f076384d1a76f39fd100c8b369cf3756,"BACKGROUND
The prostate component of the Prostate, Lung, Colorectal, and Ovarian (PLCO) Cancer Screening Trial was undertaken to determine whether there is a reduction in prostate cancer mortality from screening using serum prostate-specific antigen (PSA) testing and digital rectal examination (DRE). Mortality after 7-10 years of follow-up has been reported previously. We report extended follow-up to 13 years after the trial.


METHODS
A total of 76 685 men, aged 55-74 years, were enrolled at 10 screening centers between November 1993 and July 2001 and randomly assigned to the intervention (organized screening of annual PSA testing for 6 years and annual DRE for 4 years; 38 340 men) and control (usual care, which sometimes included opportunistic screening; 38 345 men) arms. Screening was completed in October 2006. All incident prostate cancers and deaths from prostate cancer through 13 years of follow-up or through December 31, 2009, were ascertained. Relative risks (RRs) were estimated as the ratio of observed rates in the intervention and control arms, and 95% confidence intervals (CIs) were calculated assuming a Poisson distribution for the number of events. Poisson regression modeling was used to examine the interactions with respect to prostate cancer mortality between trial arm and age, comorbidity status, and pretrial PSA testing. All statistical tests were two-sided.


RESULTS
Approximately 92% of the study participants were followed to 10 years and 57% to 13 years. At 13 years, 4250 participants had been diagnosed with prostate cancer in the intervention arm compared with 3815 in the control arm. Cumulative incidence rates for prostate cancer in the intervention and control arms were 108.4 and 97.1 per 10 000 person-years, respectively, resulting in a relative increase of 12% in the intervention arm (RR = 1.12, 95% CI = 1.07 to 1.17). After 13 years of follow-up, the cumulative mortality rates from prostate cancer in the intervention and control arms were 3.7 and 3.4 deaths per 10 000 person-years, respectively, resulting in a non-statistically significant difference between the two arms (RR = 1.09, 95% CI = 0.87 to 1.36). No statistically significant interactions with respect to prostate cancer mortality were observed between trial arm and age (P(interaction) = .81), pretrial PSA testing (P(interaction) = .52), and comorbidity (P(interaction) = .68).


CONCLUSIONS
After 13 years of follow-up, there was no evidence of a mortality benefit for organized annual screening in the PLCO trial compared with opportunistic screening, which forms part of usual care, and there was no apparent interaction with age, baseline comorbidity, or pretrial PSA testing."
2025-06-21T01-30-36-586Z.csv,searchPapers,cancer,914215db43b87906a7a6b00e1d7735e3124195c1,Surgical treatment of liver metastasis of gastric cancer: a retrospective multicenter cohort study (KSCC1302),2016,E. Oki; S. Tokunaga; Y. Emi; T. Kusumoto; Manabu Yamamoto; K. Fukuzawa; I. Takahashi; S. Ishigami; A. Tsuji; H. Higashi; Toshihiko Nakamura; H. Saeki; K. Shirabe; Y. Kakeji; K. Sakai; H. Baba; T. Nishimaki; S. Natsugoe; Y. Maehara; Kyushu Study Group of Clinical Cancer,Gastric Cancer,119,https://www.semanticscholar.org/paper/914215db43b87906a7a6b00e1d7735e3124195c1,
2025-06-21T01-30-36-586Z.csv,searchPapers,cancer,fff8890d7c7423312e74460478a73e544dbe8cb7,Long noncoding RNAs and the genetics of cancer,2013,S. W. Cheetham; F. Gruhl; J. Mattick; M. Dinger,British Journal of Cancer,744,https://www.semanticscholar.org/paper/fff8890d7c7423312e74460478a73e544dbe8cb7,"Cancer is a disease of aberrant gene expression. While the genetic causes of cancer have been intensively studied, it is becoming evident that a large proportion of cancer susceptibility cannot be attributed to variation in protein-coding sequences. This is highlighted by genome-wide association studies in cancer that reveal that more than 80% of cancer-associated SNPs occur in noncoding regions of the genome. In this review, we posit that a significant fraction of the genetic aetiology of cancer is exacted by noncoding regulatory sequences, particularly by long noncoding RNAs (lncRNAs). Recent studies indicate that several cancer risk loci are transcribed into lncRNAs and these transcripts play key roles in tumorigenesis. We discuss the epigenetic and other mechanisms through which lncRNAs function and how they contribute to each stage of cancer progression, understanding of which will be crucial for realising new opportunities in cancer diagnosis and treatment. Long noncoding RNAs play important roles in almost every aspect of cell biology from nuclear organisation and epigenetic regulation to post-transcriptional regulation and splicing, and we link these processes to the hallmarks and genetics of cancer. Finally, we highlight recent progress and future potential in the application of lncRNAs as therapeutic targets and diagnostic markers."
2025-06-21T01-30-36-586Z.csv,searchPapers,cancer,f54b505e2bfea33ee0e542e08574880d55e19cd9,Cancer's molecular sweet tooth and the Warburg effect.,2006,Jung-whan Kim; C. Dang,Cancer Research,1224,https://www.semanticscholar.org/paper/f54b505e2bfea33ee0e542e08574880d55e19cd9,"More than 80 years ago, the renowned biochemist Otto Warburg described how cancer cells avidly consume glucose and produce lactic acid under aerobic conditions. Recent studies arguing that cancer cells benefit from this phenomenon, termed the Warburg effect, have renewed discussions about its exact role as cause, correlate, or facilitator of cancer. Molecular advances in this area may reveal tactics to exploit the cancer cell's ""sweet tooth"" for cancer therapy."
